{
  "contractVersion": "0.1.0",
  "packageId": "example-notes",
  "displayName": "Example Notes",
  "version": "0.1.0",
  "type": "APPLICATION",
  "compatibility": {
    "appPlatform": ">=0.1.0 <0.2.0",
    "eidos": "^1.3.0",
    "pluginProtocol": "0.1.0"
  },
  "publisher": {
    "id": "example-team",
    "displayName": "Example Team",
    "trust": "FIRST_PARTY",
    "source": "internal"
  },
  "features": [
    {
      "contractVersion": "0.1.0",
      "featureId": "example-notes.default",
      "packageId": "example-notes",
      "version": "0.1.0",
      "activationScope": "INSTALLATION",
      "defaultActivation": true,
      "activation": {
        "mode": "EAGER"
      },
      "providesCapabilities": [
        "example-notes"
      ],
      "contributions": [
        {
          "kind": "eidos.workbench-activity",
          "activity": {
            "contractVersion": "0.1.0",
            "id": "example-notes",
            "title": "Example Notes",
            "icon": "document",
            "kind": "workspace-route",
            "route": "/example-notes",
            "order": 100,
            "placement": "primary"
          }
        }
      ]
    }
  ]
}
